{
  "schema": "sensor.report.v1",
  "tool": {
    "name": "depguard",
    "version": "0.1.0"
  },
  "run": {
    "started_at": "2025-01-01T00:00:00Z",
    "ended_at": "2025-01-01T00:00:01Z",
    "duration_ms": 1000,
    "capabilities": {
      "git": { "status": "available" },
      "config": { "status": "available" }
    }
  },
  "verdict": {
    "status": "pass",
    "counts": {
      "info": 0,
      "warn": 0,
      "error": 0
    },
    "reasons": []
  },
  "findings": [],
  "data": {
    "scope": "repo",
    "profile": "strict",
    "manifests_scanned": 1,
    "dependencies_scanned": 5,
    "findings_total": 0,
    "findings_emitted": 0
  }
}
