{
  "schema": "sensor.report.v1",
  "tool": {
    "name": "depguard",
    "version": "0.1.0"
  },
  "run": {
    "started_at": "2025-01-01T00:00:00Z",
    "ended_at": "2025-01-01T00:00:01Z",
    "duration_ms": 500,
    "capabilities": {
      "git": { "status": "degraded", "reason": "diff_scope_disabled" },
      "config": { "status": "available" }
    }
  },
  "verdict": {
    "status": "skip",
    "counts": {
      "info": 0,
      "warn": 0,
      "error": 0
    },
    "reasons": ["no_manifest_found"]
  },
  "findings": [],
  "data": {
    "scope": "repo",
    "profile": "strict",
    "manifests_scanned": 0,
    "dependencies_scanned": 0,
    "findings_total": 0,
    "findings_emitted": 0
  }
}
