{
  "schema": "sensor.report.v1",
  "tool": {
    "name": "depguard",
    "version": "__VERSION__"
  },
  "run": {
    "started_at": "__TIMESTAMP__",
    "ended_at": "__TIMESTAMP__",
    "duration_ms": 0,
    "capabilities": {
      "git": {
        "status": "missing",
        "reason": "diff_scope_disabled"
      },
      "config": {
        "status": "missing",
        "reason": "config_missing_defaulted"
      }
    }
  },
  "verdict": {
    "status": "pass",
    "counts": {
      "info": 0,
      "warn": 0,
      "error": 0
    },
    "reasons": []
  },
  "findings": [],
  "data": {
    "scope": "repo",
    "profile": "strict",
    "manifests_scanned": 1,
    "dependencies_scanned": 5,
    "findings_total": 0,
    "findings_emitted": 0
  }
}
