{
  "schema": "sensor.report.v1",
  "tool": {
    "name": "depguard",
    "version": "0.1.0"
  },
  "run": {
    "started_at": "2025-01-01T00:00:00Z",
    "ended_at": "2025-01-01T00:00:01Z",
    "duration_ms": 1000,
    "capabilities": {
      "git": { "status": "available" },
      "config": { "status": "available" }
    }
  },
  "verdict": {
    "status": "warn",
    "counts": {
      "info": 0,
      "warn": 1,
      "error": 0
    },
    "reasons": []
  },
  "findings": [
    {
      "severity": "warn",
      "check_id": "deps.path_requires_version",
      "code": "path_without_version",
      "message": "dependency 'foo' has a path dependency without a version constraint",
      "location": {
        "path": "Cargo.toml",
        "line": 7
      },
      "help": "Add a version field alongside the path dependency."
    }
  ],
  "data": {
    "scope": "repo",
    "profile": "strict",
    "manifests_scanned": 1,
    "dependencies_scanned": 3,
    "findings_total": 1,
    "findings_emitted": 1
  }
}
